{
  "created_at": "2026-05-26T11:29:16-04:00",
  "status": "accepted",
  "slice": "S02",
  "lane": "swr_preferred",
  "decision": "use_swr",
  "risk": "high",
  "reason": "S02 is a high-risk swr_preferred slice. The launch path must use the staged-workflow-runner gstack_design_to_po_playbook lane to generate the markdown_playbook_v1 artifact before PO execution. A deterministic keel-compile downgrade is not accepted for this slice.",
  "review_artifacts": [
    "docs/reviews/s02-autonomous-security-review.md",
    "docs/reviews/s02-autonomous-privacy-review.md"
  ],
  "commands": [
    {
      "command": "python scripts/verify_autonomy_preflight.py --json",
      "exit_code": 0,
      "stdout_tail": "status=ok; warnings include dirty worktree because this implementation branch had uncommitted v5 changes during the lane-decision review",
      "stderr_tail": ""
    },
    {
      "command": "python -m ops.autonomy.autokeel --doctor",
      "exit_code": 0,
      "stdout_tail": "status=ok; warnings include dirty worktree because this implementation branch had uncommitted v5 changes during the lane-decision review",
      "stderr_tail": ""
    }
  ],
  "verdict": "pass"
}
