{
  "commands": [
    {
      "command": "python -m ops.autonomy.autokeel --doctor --strict-swr S05",
      "exit_code": 0,
      "stderr_tail": "",
      "stdout_tail": "{\n  \"checks\": {\n    \"git_clean\": true,\n    \"git_repo\": true,\n    \"keel-compile_exists\": true,\n    \"keel-doctor_exists\": true,\n    \"keel-run_exists\": true,\n    \"keel-smoke_exists\": true,\n    \"keel-swr_exists\": true,\n    \"keel_root_exists\": true,\n    \"product_repo_exists\": true,\n    \"python_modules\": {\n      \"duckdb\": true\n    }\n  },\n  \"errors\": [],\n  \"status\": \"ok\",\n  \"strict_swr\": {\n    \"missing_env\": [],\n    \"provider\": \"openai\",\n    \"secret_values_logged\": false,\n    \"slice\": \"S05\",\n    \"status\": \"ok\"\n  },\n  \"warnings\": []\n}\n"
    },
    {
      "command": "python scripts/verify_s05_provider_policy.py --json",
      "exit_code": 0,
      "stderr_tail": "",
      "stdout_tail": "{\n  \"checks\": {\n    \"active_sleep_provider\": \"oura\",\n    \"eight_sleep_allowed_for_features\": false,\n    \"eight_sleep_state\": \"fallback_active\",\n    \"model_training_forbidden_8sleep_references\": [],\n    \"s03_status\": \"complete\",\n    \"s04_status\": \"complete\",\n    \"warehouse_database\": null\n  },\n  \"errors\": [],\n  \"status\": \"ok\",\n  \"warnings\": [\n    \"model source directory is not present yet; source scan skipped\"\n  ]\n}\n"
    },
    {
      "command": "python scripts/check_no_tracked_data.py --json",
      "exit_code": 0,
      "stderr_tail": "",
      "stdout_tail": "{\n  \"errors\": [],\n  \"status\": \"ok\",\n  \"warnings\": []\n}\n"
    },
    {
      "command": "python scripts/verify_failure_ledger.py --json",
      "exit_code": 0,
      "stderr_tail": "",
      "stdout_tail": "cs: row 17 compile_failure\",\n    \"legacy repeated failure class lacks root_cause_id: compile_failure\",\n    \"legacy ledger row without v2 semantics: row 18 compile_failure\",\n    \"legacy repeated failure class lacks root_cause_id: compile_failure\",\n    \"legacy ledger row without v2 semantics: row 19 compile_failure\",\n    \"legacy repeated failure class lacks root_cause_id: compile_failure\",\n    \"legacy ledger row without v2 semantics: row 20 unsafe_write_root\",\n    \"legacy repeated failure class lacks root_cause_id: unsafe_write_root\",\n    \"legacy ledger row without v2 semantics: row 21 state_divergence\",\n    \"legacy ledger row without v2 semantics: row 22 compile_failure\",\n    \"legacy repeated failure class lacks root_cause_id: compile_failure\",\n    \"legacy ledger row without v2 semantics: row 23 test_failure\",\n    \"legacy repeated failure class lacks root_cause_id: test_failure\",\n    \"legacy ledger row without v2 semantics: row 24 test_failure\",\n    \"legacy repeated failure class lacks root_cause_id: test_failure\",\n    \"legacy ledger row without v2 semantics: row 25 state_divergence\",\n    \"legacy repeated failure class lacks root_cause_id: state_divergence\",\n    \"legacy ledger row without v2 semantics: row 26 state_divergence\",\n    \"legacy repeated failure class lacks root_cause_id: state_divergence\",\n    \"legacy ledger row without v2 semantics: row 27 audit_failure\",\n    \"legacy ledger row without v2 semantics: row 28 state_divergence\",\n    \"legacy repeated failure class lacks root_cause_id: state_divergence\",\n    \"legacy ledger row without v2 semantics: row 29 audit_failure\",\n    \"legacy ledger row without v2 semantics: row 30 audit_failure\",\n    \"legacy repeated failure class lacks root_cause_id: audit_failure\",\n    \"legacy ledger row without v2 semantics: row 31 review_artifact_invalid\",\n    \"legacy ledger row without v2 semantics: row 32 provider_auth_failure\",\n    \"legacy wrapper false-positive row lacks false_positive=true: row 32 provider_auth_failure\"\n  ]\n}\n"
    }
  ],
  "created_at": "2026-05-31T19:05:54-04:00",
  "decision": "use_swr",
  "lane": "swr_preferred",
  "reason": "High-risk swr_preferred slice must be generated by keel-swr. This decision was materialized only after strict SWR provider preflight, slice provider-policy preflight, tracked-data hygiene, and failure-ledger checks passed.",
  "review_artifacts": [
    "docs/reviews/s05-autonomous-model-gate-review.md",
    "docs/reviews/s05-autonomous-statistical-validity-review.md"
  ],
  "risk": "high",
  "slice": "S05",
  "status": "accepted",
  "verdict": "pass"
}
